?cls	?def	?xrefs
<http://purl.obolibrary.org/obo/CHEBI_27899>	"A diamminedichloroplatinum compound in which the two ammine ligands and two chloro ligands are oriented in a cis planar configuration around the central platinum ion. An anticancer drug that interacts with, and forms cross-links between, DNA and proteins, it is used as a neoplasm inhibitor to treat solid tumours, primarily of the testis and ovary. Commonly but incorrectly described as an alkylating agent due to its mechanism of action (but it lacks alkyl groups)."	"KEGG:D00275 HMDB:HMDB0014656 Patent:DE2318020 MetaCyc:CPD0-1392 Wikipedia:Cisplatin DrugBank:DB00515 MolBase:25 Patent:DE2329485 KEGG:C06911"
<http://purl.obolibrary.org/obo/FBcv_0000495>	"Mutation caused by a male recombination event induced by male recombination factor 23.5 MRF which is present in second chromosomes extracted from a population in Patras, Greece."	
<http://purl.obolibrary.org/obo/FBcv_0000788>	"A work consisting of a news item appearing in a general-interest newspaper or other general news periodical, containing information of current and timely interest in the field of medicine or science."	"MeSH:D018431"
<http://purl.obolibrary.org/obo/CHEBI_35803>	"N-Nitroso amines, compounds of the structure R2NNO. Compounds RNHNO are not ordinarily isolable, but they, too, are nitrosamines. The name is a contraction of N-nitrosoamine and, as such, does not require the N locant."	"Wikipedia:Nitrosamine"
<http://purl.obolibrary.org/obo/CHEBI_23995>	"A member of the class of N-nitrosoureas that is urea in which one of the nitrogens is substituted by ethyl and nitroso groups."	"KEGG:C19178 Wikipedia:ENU"
<http://purl.obolibrary.org/obo/FBcv_0007034>	"Genes whose products act in a specified signal transduction pathway."	
<http://purl.obolibrary.org/obo/FBcv_0000107>	"30-100% of egg length from the posterior tip (0%) of the egg or pre-gastrula embryo."	
<http://purl.obolibrary.org/obo/FBcv_0003039>	"A project that searches for chemicals, natural or synthetic, that elicit some biological effect."	
<http://purl.obolibrary.org/obo/FBcv_0003085>	"A result in which a collection of whole genome shotgun sequences is combined to build successively larger contigs."	
<http://purl.obolibrary.org/obo/FBcv_0000375>	"A phenotype that is a reduction in the ability to produce fertilized eggs as a result of mating, but only to > 50% of wild-type."	
<http://purl.obolibrary.org/obo/FBcv_0000647>		
<http://purl.obolibrary.org/obo/CHEBI_33658>	"Any monocyclic or polycyclic aromatic hydrocarbon."	
<http://purl.obolibrary.org/obo/FBcv_0000506>	"Mutation induced by exposure to gamma rays."	
<http://purl.obolibrary.org/obo/CHEBI_33249>	"Any organic substituent group, regardless of functional type, having one free valence at a carbon atom."	
<http://purl.obolibrary.org/obo/FBcv_0000603>	"No definition for CHEBI:26800."	
<http://purl.obolibrary.org/obo/CHEBI_33521>	"An atom of an element that exhibits typical metallic properties, being typically shiny, with high electrical and thermal conductivity."	"KEGG:C00050 Wikipedia:Metal"
<http://purl.obolibrary.org/obo/FBcv_0005054>	"Non-functional fragment of a transcriptional activator ('driver') that includes a DNA-binding domain and which can be used to reconstitute a functional transcription driver when brought together in vivo with a complementary split driver fragment that encodes a transcription activation domain, for example by including a compatible physical interaction domain or split intein fragment in each of the complementary split driver fragments."	
<http://purl.obolibrary.org/obo/CHEBI_51061>	"A drug that modulates the function of the endocrine glands, the biosynthesis of their secreted hormones, or the action of hormones upon their specific sites."	
<http://purl.obolibrary.org/obo/FBcv_0000372>	"A phenotype of male sterility due to defects in the male germline."	
<http://purl.obolibrary.org/obo/FBcv_0003193>	"Material that has been selected using DNA Adenine Methyltransferase Identification, or DamID."	
<http://purl.obolibrary.org/obo/FBcv_0000294>	"Allele that corresponds to the wild-type one."	
<http://purl.obolibrary.org/obo/CHEBI_51067>		
<http://purl.obolibrary.org/obo/CHEBI_37972>	"The radioactive isotope of phosphorus with relative atomic mass 31.973907 and half-life of 14.26 days."	"KEGG:C19162"
<http://purl.obolibrary.org/obo/CHEBI_131927>	"A class of carbonyl compound encompassing dicarboxylic acids and any derivatives obtained by substitution of either one or both of the carboxy hydrogens."	
<http://purl.obolibrary.org/obo/FBcv_0000072>		
<http://purl.obolibrary.org/obo/CHEBI_39087>	"Any sulfur oxoacid derivative derived from sulfurous acid."	
<http://purl.obolibrary.org/obo/FBcv_0003190>	"Material that has undergone the depletion of unbound RNA."	
<http://purl.obolibrary.org/obo/CHEBI_32487>	"An optically active form of phenylalaninium having L-configuration."	
<http://purl.obolibrary.org/obo/CHEBI_50750>	"A topoisomerase inhibitor that inhibits DNA topoisomerase (ATP-hydrolysing), EC 5.99.1.3 (also known as topoisomerase II and as DNA gyrase), which catalyses ATP-dependent breakage of both strands of DNA, passage of the unbroken strands through the breaks, and rejoining of the broken strands."	
<http://purl.obolibrary.org/obo/FBcv_0003058>	"An assay that characterizes the genome's DNase hypersensitivity using high-throughput sequencing."	
<http://purl.obolibrary.org/obo/FBcv_0007537>	"Phenotype that is an increase in any kind of rate (e.g. speed, frequency) of larval locomotory behavior (GO:0008345). 'larval locomotory behavior' is defined as: 'Locomotory behavior in a larval (immature) organism.'."	
<http://purl.obolibrary.org/obo/FBcv_0000064>	"Restricted to medial region of some specified type."	
<http://purl.obolibrary.org/obo/CHEBI_228364>	"Any compound that produces a peak used to reference an NMR spectrum during data pre-processing."	
<http://purl.obolibrary.org/obo/FBcv_0005068>	"Sequence that forms all or part of a transgenic locus or modified endogenous locus and which is designed to impact or assess any proximate gene(s) when integrated into the genome."	
<http://purl.obolibrary.org/obo/FBcv_0002037>	"A phenotype of a population that is the death of the majority of animals in that population during the embryonic stage."	
<http://purl.obolibrary.org/obo/CHEBI_3992>		"KEGG:C02019"
<http://purl.obolibrary.org/obo/FBcv_0003176>	"A type of biomolecule that is isolated from a biosample and characterized by downstream steps in an assay."	
<http://purl.obolibrary.org/obo/FBcv_0000733>	"Expression is limited to virgin males."	
<http://purl.obolibrary.org/obo/FBcv_0005022>	"Sequence that forms part of the gene product encoded by a transgenic locus or modified endogenous locus and which is used to target the tagged gene product either to a specific subcellular location within the cell or for secretion to the extracellular space."	
<http://purl.obolibrary.org/obo/FBcv_0000288>	"An allele inferred to completely lack function from the observation that addition of extra copies in the genome has no effect on the phenotype. Most commonly, evidence takes the form of the observation that the phenotype of homozygotes (2 copies) is identical to that seen when the allele is in trans to a deletion of the gene (1 copy)."	
<http://purl.obolibrary.org/obo/CHEBI_41189>	"A butanediol that is butane in which one hydrogen of each of the methyl groups is substituted by a hydroxy group. A colourless, water-miscible, viscous liquid at room temperature (m.p. 16degreeC) with a high boiling point (230degreeC), it is mainly used for the production of other organic chemicals, particularly the solvent oxolane (also known as tetrahydrofuran or THF)."	"Wikipedia:1,4-Butanediol DrugBank:DB01955 PDBeChem:BU1"
<http://purl.obolibrary.org/obo/FBcv_0000688>	"An allele that completely lacks function, coding either for a completely inactive gene product or none at all."	
<http://purl.obolibrary.org/obo/FBcv_0005051>	"Component that forms part of a 'split system'. A split system component corresponds to a non-functional fragment of a functional experimental tool. When combined with another appropriate split system component in vivo, a functional experimental tool is produced. The fragments of a split system can be brought together in vivo in a number of different ways; for example, by fusing fragments to peptides that physically interact in vivo."	
<http://purl.obolibrary.org/obo/FBcv_0000743>	"An allele shown by molecular evidence to completely lack function at high temperatures (restrictive temperatures) but not at low temperatures (permissive temperatures)."	
<http://purl.obolibrary.org/obo/FBcv_0003237>	"The assembly represents the whole genome, though there may still be gaps."	
<http://purl.obolibrary.org/obo/FBcv_0007544>	"Phenotype that is a decrease in any kind of rate (e.g. speed, frequency) of chemosensory behavior (GO:0007635). 'chemosensory behavior' is defined as: 'Behavior that is dependent upon the sensation of chemicals.'."	
<http://purl.obolibrary.org/obo/FBcv_0000672>	"Phenotype that is any abnormality in endomitotic cell cycle (GO:0007113). 'endomitotic cell cycle' is defined as: 'A mitotic cell cycle in which chromosomes are replicated and sister chromatids separate, but spindle formation, nuclear membrane breakdown and nuclear division do not occur, resulting in an increased number of chromosomes in the cell.'"	
<http://purl.obolibrary.org/obo/FBcv_0000671>	"Phenotype that is any abnormality in cell cycle (GO:0007049). 'cell cycle' is defined as: 'The progression of biochemical and morphological phases and events that occur in a cell during successive cell replication or nuclear replication events. Canonically, the cell cycle comprises the replication and segregation of genetic material followed by the division of the cell, but in endocycles or syncytial cells nuclear replication or nuclear division may not be followed by cell division.'"	
<http://purl.obolibrary.org/obo/FBcv_0000649>		
<http://purl.obolibrary.org/obo/FBcv_0000409>	"Phenotype that is any abnormality in response to osmotic stress (GO:0006970). 'response to osmotic stress' is defined as: 'Any process that results in a change in state or activity of a cell or an organism (in terms of movement, secretion, enzyme production, gene expression, etc.) as a result of a stimulus indicating an increase or decrease in the concentration of solutes outside the organism or cell.'"	
<http://purl.obolibrary.org/obo/FBcv_0000406>	"Phenotype that is any abnormality in or absense of proboscis extension reflex in response to a sugar stimulus via taste sensilla on the tarsus."	
<http://purl.obolibrary.org/obo/FBcv_0009033>	"Catalytically inactive fragment of a protease that can be used to reconstitute a functional protease when brought together in vivo with a complementary split protease fragment, where the process that brings the complementary fragments together can be regulated in response to a particular stimulus."	
<http://purl.obolibrary.org/obo/CHEBI_33653>	"Any acyclic or cyclic, saturated or unsaturated carbon compound, excluding aromatic compounds."	
<http://purl.obolibrary.org/obo/FBcv_0000752>	"An allele that makes a gene product that is functionally equivalent to wild-type but which at high temperatures is present in a lesser amount or with lowered activity, and that retains normal levels of expression or activity at low temperatures."	
<http://purl.obolibrary.org/obo/CHEBI_172390>	"A hydroxyether which contains both an ether and alcohol functional groups. It is one of the most versatile classes of organic solvents which are commonly used in paints, cleaners, adhesives, pharmaceuticals and cosmetics."	"Wikipedia:Glycol_ethers"
<http://purl.obolibrary.org/obo/CHEBI_72544>	"Any organic molecular entity whose stucture is based on derivatives of a phenyl-substituted 1-phenylpropane possessing a C15 or C16 skeleton, or such a structure which is condensed with a C6-C3 lignan precursors. The term is a 'superclass' comprising all members of the classes of flavonoid, isoflavonoid, neoflavonoid, chalcones, dihydrochalcones, aurones, pterocarpan, coumestans, rotenoid, flavonolignan, homoflavonoid and flavonoid oligomers. Originally restricted to natural products, the term is also applied to synthetic compounds related to them."	"Wikipedia:Flavonoids"
<http://purl.obolibrary.org/obo/FBcv_0007047>	"Sequence that forms part of the gene product encoded by a transgenic locus or modified endogenous locus and which results in the tagged gene product being targeted for degradation, where this property can be regulated by irradiation with a pulse of light."	
<http://purl.obolibrary.org/obo/CHEBI_63353>	"A carbohydrate derivative that is formally obtained from a disaccharide."	
<http://purl.obolibrary.org/obo/FBcv_0005002>	"Sequence that forms all or part of the gene product encoded by a transgenic locus or modified endogenous locus and confers a specific property that facilitates detection of that gene product by an experimental method."	
<http://purl.obolibrary.org/obo/CHEBI_35471>	"A loosely defined grouping of drugs that have effects on psychological function."	"Wikipedia:Psychotropic_drug"
<http://purl.obolibrary.org/obo/FBcv_0000062>		
<http://purl.obolibrary.org/obo/CHEBI_33302>	"A p-block molecular entity containing any pnictogen."	
<http://purl.obolibrary.org/obo/FBcv_0003120>	"A collection of hybridization targets on a microarray."	
<http://purl.obolibrary.org/obo/CHEBI_51151>	"An  organic molecule that is electrically neutral carrying a positive and a negative charge in one of its major canonical descriptions. In most dipolar compounds the charges are delocalized; however the term is also applied to species where this is not the case."	
<http://purl.obolibrary.org/obo/FBcv_0000097>	"20% of egg length from the posterior tip of the egg or pre-gastrula embryo."	
<http://purl.obolibrary.org/obo/CHEBI_37598>	"Compounds having two beta-haloalkyl groups bound to a nitrogen atom, as in (X-CH2-CH2)2NR."	"Wikipedia:Nitrogen_mustard"
<http://purl.obolibrary.org/obo/FBcv_0005015>	"A fluorescent protein whose spectral properties are changeable, resulting from a reversible or irreversible change in fluorophore conformation. Changes in fluorophore conformation may occur either as a function of time (in the case of fluorescent timer proteins), or in response to an external trigger such as irradiation with a specific wavelength of light (in the case of photomodulatable fluorescent proteins)."	
<http://purl.obolibrary.org/obo/CHEBI_28262>	"A 2-carbon sulfoxide in which the sulfur atom has two methyl substituents."	"Wikipedia:Dimethyl_sulfoxide DrugBank:DB01093 KEGG:C11143 HMDB:HMDB0002151 PDBeChem:DMS MetaCyc:DMSO LINCS:LSM-36361 KNApSAcK:C00053120 FooDB:FDB000764 KEGG:D01043 Chemspider:659"
<http://purl.obolibrary.org/obo/FBcv_0005043>	"Sequence that forms part of the gene product encoded by a transgenic locus or modified endogenous locus and which results in the tagged gene product being targeted for degradation, where this property can be regulated by the cell cycle."	
<http://purl.obolibrary.org/obo/FBcv_0010003>		
<http://purl.obolibrary.org/obo/FBcv_0000807>	"Descriptor that relates to aspects of an allele."	
<http://purl.obolibrary.org/obo/FBcv_0002006>	"A phenotype of a population that is the death of all animals in that population during the first instar larval stage."	
<http://purl.obolibrary.org/obo/FBcv_0000127>	"60% of egg length from the posterior tip of the egg or pre-gastrula embryo."	
<http://purl.obolibrary.org/obo/FBcv_0003207>	"Nucleotide analogs that are used to map the position and orientation of the RNA polymerase active site."	
<http://purl.obolibrary.org/obo/CHEBI_32458>		
<http://purl.obolibrary.org/obo/FBcv_0003229>	"A unit of expression (reads per million reads) in which high-throughput sequencing reads for a given type of feature are normalized against all reads mapping to all features of the same type."	
<http://purl.obolibrary.org/obo/FBcv_0005019>	"A protein that can be reversibly switched between a non-fluorescent state and a fluorescent state, or between two different fluorescent states. The switch from one state to the other is triggered by irradiation with a pulse of light of a specific wavelength, and the switch back to the original state is triggered with a pulse of light of another specific wavelength."	
<http://purl.obolibrary.org/obo/FBcv_0000022>	"Expressivity measures the extent to which a given genotype is expressed at the phenotypic level. Expressivity is complete when an individual of a given genotype expresses the full phenotype associated with that genotype."	
<http://purl.obolibrary.org/obo/FBcv_0000604>	"A member of the class of 1,4-benzoquinones that is 1,4-benzoquinone in which three of the ring hydrogens are replaced by aziridin-1-yl groups (from CHEBI)."	
<http://purl.obolibrary.org/obo/FBcv_0000235>	"Publication in the Afrikaans language."	
<http://purl.obolibrary.org/obo/FBcv_0000315>	"Phenotype expressed only in the presence of tetracycline (CHEBI:27902)."	
<http://purl.obolibrary.org/obo/FBcv_0000140>	"A record of an analysis carried out by FlyBase that has not been formally published."	
<http://purl.obolibrary.org/obo/FBcv_0003110>	"A collection of large chromosomal aberrations, available as fly stocks, which may include duplications, deletions, inversions or translocations."	
<http://purl.obolibrary.org/obo/FBcv_0000759>	"An allele shown by molecular evidence to make a normal gene product in normal amounts at low temperatures, but at higher temperatures to make a gene product that is functionally equivalent to wild-type but in a lesser amount or with lowered activity."	
<http://purl.obolibrary.org/obo/CHEBI_83414>	"An organosulfate oxoanion obtained by deprotonation of the sulfo group of any alkyl sulfate; major species at pH 7.3."	
<http://purl.obolibrary.org/obo/CHEBI_33637>	"A polycyclic compound in which two rings have two, and only two, atoms in common. Such compounds have n common faces and 2n common atoms."	
<http://purl.obolibrary.org/obo/FBcv_0003069>	"Measurement of transcribed regions across the genome by hybridization of cDNA to an oligonucleotide array, in which the genome is represented by oligonucleotides at regularly spaced intervals."	
<http://purl.obolibrary.org/obo/FBcv_0000639>		
<http://purl.obolibrary.org/obo/FBcv_0007538>	"Phenotype that is an increase in any kind of rate (e.g. speed, frequency) of adult locomotory behavior (GO:0008344). 'adult locomotory behavior' is defined as: 'Locomotory behavior in a fully developed and mature organism.'."	
<http://purl.obolibrary.org/obo/FBcv_0000488>	"Mutation induced by the mobilization of a P-element by the Delta2-3 transposase. The source of Delta2-3 is a stable genomic integration from which the third intron has been deleted."	
<http://purl.obolibrary.org/obo/FBcv_0010002>		
<http://purl.obolibrary.org/obo/CHEBI_76971>	"Any bacterial metabolite produced during a metabolic reaction in Escherichia coli."	
<http://purl.obolibrary.org/obo/CHEBI_28659>		"WebElements:P KEGG:C06262"
<http://purl.obolibrary.org/obo/FBcv_0000155>	"Chromosome that carries inversions and visible mutations, and which can be used to identify the genotype of an individual."	
<http://purl.obolibrary.org/obo/CHEBI_48219>	"An antimicrobial agent that is applied to non-living objects to destroy harmful microorganisms or to inhibit their activity."	
<http://purl.obolibrary.org/obo/CHEBI_59740>	"A reagent that forms a bond to its reaction partner (the electrophile) by donating both bonding electrons."	
<http://purl.obolibrary.org/obo/CHEBI_68495>	"Any substance that induces the process of apoptosis (programmed cell death) in multi-celled organisms."	
<http://purl.obolibrary.org/obo/FBcv_0000215>	"A literary or oral work expressing meaning via symbolism and following formal or informal patterns."	"MeSH:D055821"
<http://purl.obolibrary.org/obo/FBcv_0003118>	"A collection of transgenic construct insertions available as fly stocks."	
<http://purl.obolibrary.org/obo/CHEBI_29985>	"An alpha-amino-acid anion that is the conjugate base of L-glutamic acid, having anionic carboxy groups and a cationic amino group"	"MetaCyc:GLT"
<http://purl.obolibrary.org/obo/CHEBI_33286>	"An agrochemical is a substance that is used in agriculture or horticulture."	"Wikipedia:Agrochemical"
<http://purl.obolibrary.org/obo/CHEBI_33306>		
<http://purl.obolibrary.org/obo/FBcv_0010001>		
<http://purl.obolibrary.org/obo/CHEBI_8711>	"A member of the class of acridines that is acridine substituted by a chloro group at position 6, a methoxy group at position 2 and a [5-(diethylamino)pentan-2-yl]nitrilo group at position 9."	"DrugBank:DB01103 KEGG:D08179 Wikipedia:Quinacrine MetaCyc:ATABRINE LINCS:LSM-1577 KEGG:C07339 HMDB:HMDB0015235"
<http://purl.obolibrary.org/obo/CHEBI_50326>		
<http://purl.obolibrary.org/obo/FBcv_0003024>	"Biological source material characterized by an experiment."	
<http://purl.obolibrary.org/obo/FBcv_0005063>	"The recognition site for a particular site-specific recombinase, an enzyme that mediates a recombination exchange reaction between two DNA templates, each containing a copy of the recognition site. The recognition site contains perfect inverted repeats flanking an asymmetric spacer. Under normal conditions, the two recognition sites are identical and are reformed during the recombination event, and thus the reaction is bidirectional: recombination can occur in both 'forward' and 'reverse' directions. However, recognition sites can be mutated to drive the directionality of the reaction: different classes of site may be combined so that recombination can occur in one direction, but produces reformed sites that are no longer compatible. In addition, mutually exclusive sites have been engineered for some recombinases. Recombinases can be used to generate many different types of genetic modification, with the outcome being influenced by the relative orientation (direct or inverted), relative location and composition of the two recognition sites. The types of possible modification include deletion of DNA, generation of chromosomal rearrangements, integration of DNA into the genome, and replacement of genetic material with that from a donor plasmid using recombination-mediated cassette exchange (RMCE)."	
<http://purl.obolibrary.org/obo/FBcv_0000196>		
<http://purl.obolibrary.org/obo/FBcv_0005034>	"A peptide sequence that forms part of the protein product encoded by a transgenic locus or modified endogenous locus and which is used to target the tagged protein to the secretory pathway. This results in the protein either being secreted or inserted into a cellular membrane, depending on the presence of other specific sequences in the tagged protein. The signal sequence must be fused to the N-terminal end of the tagged protein."	"SO:0000418"
<http://purl.obolibrary.org/obo/CHEBI_24624>	"A methanesulfonate salt resulting from the reaction of equimolar amounts of hycanthone and methanesulfonic acid. It was formerly used as a schistosomicide for individual or mass treatement of infection with Schistosoma haematobium and S. mansoni, but due to its toxicity and concern about possible carcinogenicity, it has been replaced by other drugs such as praziquantel."	"KEGG:C19432"
<http://purl.obolibrary.org/obo/FBcv_0000707>	"Phenotype that is any abnormality in entry into reproductive diapause (GO:0055116). 'entry into reproductive diapause' is defined as: 'The dormancy process that results in entry into reproductive diapause. Reproductive diapause is a form of diapause where the organism itself will remain fully active, including feeding and other routine activities, but the reproductive organs experience a tissue-specific reduction in metabolism, with characteristic triggering and releasing stimuli.'"	
<http://purl.obolibrary.org/obo/FBcv_0000500>	"Mutation induced by the transposable activity caused by mariner, a DNA transposable element. The mariner element is 1.3 kilobases in length with 28 base pairs inverted terminal repeats. It specifically targets TA dinucleotides and generates a flanking duplication of these two bases upon insertion. Mobilization is induced by the activity of the mariner transposase."	
<http://purl.obolibrary.org/obo/CHEBI_139358>	"Any molecular entity in which the isotopic ratio of nuclides for at least one element deviates measurably from that occurring in nature. The term includes both isotopically substituted compounds (in which essentially all the molecules of the compound have only the indicated nuclide(s) at each designated position) and isotopically labeled compounds (a formal mixture of an isotopically unmodified compound with one or more analogous isotopically substituted compound(s)."	
<http://purl.obolibrary.org/obo/FBcv_0000069>	"Expressed everywhere at some specified stage."	
<http://purl.obolibrary.org/obo/CHEBI_33229>	"A biochemical role played by any micronutrient that is an organic compound. Vitamins are present in foods in small amounts and are essential to normal metabolism and biochemical functions, usually as coenzymes. The term \"vitamines\" (from vita + amines) was coined in 1912 by Casimir Funk, who believed that these compounds were amines."	"Wikipedia:Vitamin"
<http://purl.obolibrary.org/obo/UBERON_0001062>		
<http://purl.obolibrary.org/obo/FBcv_0000379>	"Genotype g1 is an enhancer of variegation if, and only if, some genotype g2 has a variegated phenotype and the degree of variegation caused by g1g2 is greater than that caused by g2 alone."	
<http://purl.obolibrary.org/obo/FBcv_0010000>		
<http://purl.obolibrary.org/obo/FBcv_0005018>	"A protein that can be converted from one fluorescent state to another fluorescent state (with a changed emission spectrum peak) by irradiation with a pulse of light of a specific wavelength. This conversion is irreversible."	
