?cls	?def	?xrefs
<http://purl.obolibrary.org/obo/FBcv_0000606>	"Assay method used to generate an allele."	
<http://purl.obolibrary.org/obo/FBcv_0003071>	"An assay that identifies and characterizes of proteins and their post-translational modifications by mass spectrometry."	
<http://purl.obolibrary.org/obo/FBcv_0009026>	"A combination of two or more 'split system components' that together reconstitute a functional experimental tool."	
<http://purl.obolibrary.org/obo/FBcv_0000251>	"Publication in the Flemish language."	
<http://purl.obolibrary.org/obo/FBcv_0005053>	"Sequence that forms all or part of the protein product encoded by a transgenic locus or modified endogenous locus and that encodes a catalytically inactive fragment of an enzyme whose activity can be used to detect the presence of that protein product when complementary split reporter enzyme fragments are brought together in vivo. Fragments may be brought together when fused to peptides that physically interact, permitting the study of protein-protein interactions."	
<http://purl.obolibrary.org/obo/CHEBI_33232>	"Intended use of the molecular entity or part thereof by humans."	
<http://purl.obolibrary.org/obo/CHEBI_53121>	"An antagonist at the A2A receptor."	"Wikipedia:Adenosine_A2A_receptor"
<http://purl.obolibrary.org/obo/FBcv_0000667>	"A set of related web pages containing content such as text, images, video, audio, etc., prepared and maintained as a collection of information on a particular subject."	
<http://purl.obolibrary.org/obo/FBcv_0000480>	"Sequence change caused by the cleavage of an 18 base pair DNA sequence by the I-SceI endonuclease."	
<http://purl.obolibrary.org/obo/CHEBI_64709>	"Any organic molecular entity that is acidic and contains carbon in covalent linkage."	
<http://purl.obolibrary.org/obo/CHEBI_33555>	"Organic derivatives of sulfonic acid in which the sulfo group is linked directly to carbon of an aryl group."	
<http://purl.obolibrary.org/obo/CHEBI_25213>		
<http://purl.obolibrary.org/obo/CHEBI_22718>	"A monocarboxylic acid anion obtained by deprotonation of the carboxy group of any benzoic acid."	
<http://purl.obolibrary.org/obo/FBcv_0003092>	"An analysis that results in the identification of discrete transcription start site regions."	
<http://purl.obolibrary.org/obo/CHEBI_37949>		
<http://purl.obolibrary.org/obo/FBcv_0000089>	"10-30% of egg length from the posterior tip (0%) of the egg or pre-gastrula embryo."	
<http://purl.obolibrary.org/obo/FBcv_0000125>	"50-80% of egg length from the posterior tip (0%) of the egg or pre-gastrula embryo."	
<http://purl.obolibrary.org/obo/FBcv_0000624>	"A phenotype due to genotype g1 is enhanceable by genotype g2 if (and only if) the phenotype due to the genotype g1g2 is more severe than the sum of phenotypes due to g1 and g2, where all comparisons are under identical environmental conditions."	
<http://purl.obolibrary.org/obo/FBcv_0000616>		
<http://purl.obolibrary.org/obo/FBcv_0000268>	"Publication in the Norwegian language."	
<http://purl.obolibrary.org/obo/FBcv_0000456>	"Sequence change introduced by using an in vitro construct that contains a fusion of the regulatory region of one gene on to the coding region of another. Examples in FlyBase include heat shock constructs, FRT flip out constructs and reporter genes."	
<http://purl.obolibrary.org/obo/CHEBI_38101>	"Any organonitrogen compound containing a cyclic component with nitrogen and at least one other element as ring member atoms."	
<http://purl.obolibrary.org/obo/CHEBI_137982>	"An organic cation obtained by protonation of the amino group of any tertiary amino compound."	
<http://purl.obolibrary.org/obo/CHEBI_17544>	"The carbon oxoanion resulting from the removal of a proton from carbonic acid."	"MetaCyc:HCO3 KEGG:C00288 Wikipedia:Bicarbonate HMDB:HMDB0000595 PDBeChem:BCT"
<http://purl.obolibrary.org/obo/CHEBI_33893>	"A substance used in a chemical reaction to detect, measure, examine, or produce other substances."	
<http://purl.obolibrary.org/obo/FBcv_0000776>	"An allele shown by molecular evidence to produce a gene product with a novel function or expression pattern (compared to wild-type) at low temperatures but not higher temperatures."	
<http://purl.obolibrary.org/obo/FBcv_0000213>	"A work consisting of documents granted by a government giving exclusive rights to an inventor or assignee to manufacture, use, or sell an invention for a certain number of years."	"MeSH:D020490"
<http://purl.obolibrary.org/obo/CHEBI_5686>	"A cyclic compound having as ring members atoms of at least two different elements."	
<http://purl.obolibrary.org/obo/FBcv_0003028>	"The data type content of a dataset."	
<http://purl.obolibrary.org/obo/FBcv_0000482>	"Sequence change induced by chromosomal segregation."	
<http://purl.obolibrary.org/obo/FBcv_0003185>	"Material that is derived from the isolation of metabolites."	
<http://purl.obolibrary.org/obo/FBcv_0000791>	"A phenotype in which the aging process is slower than in wild-type."	
<http://purl.obolibrary.org/obo/FBcv_0000366>	"A phenotype that is the inability of females to produce fertilized eggs as a result of mating."	
<http://purl.obolibrary.org/obo/FBcv_0000615>		
<http://purl.obolibrary.org/obo/CHEBI_64775>	"An anionic group that contains carbon."	
<http://purl.obolibrary.org/obo/FBcv_0000745>	"An allele that at some temperatures but not others either makes no functional gene product or makes reduced levels of a normally functioning gene product or makes a gene product with reduced activity compared to wild-type."	
<http://purl.obolibrary.org/obo/FBcv_0007500>	"Phenotype that is any abnormality in anesthesia-resistant memory (GO:0007615). 'anesthesia-resistant memory' is defined as: 'The memory process that results in the formation of consolidated memory resistant to disruption of the patterned activity of the brain, without requiring protein synthesis.'"	
<http://purl.obolibrary.org/obo/CHEBI_33636>	"A molecule that features two fused rings."	
<http://purl.obolibrary.org/obo/CHEBI_25696>	"Any organic ion with a net negative charge."	
<http://purl.obolibrary.org/obo/FBcv_0000173>		
<http://purl.obolibrary.org/obo/FBcv_0000677>	"60-70% of egg length from the posterior tip (0%) of the egg or pre-gastrula embryo."	
<http://purl.obolibrary.org/obo/CHEBI_77746>	"Any mammalian metabolite  produced during a metabolic reaction in humans (Homo sapiens)."	
<http://purl.obolibrary.org/obo/CHEBI_22323>	"A univalent group -CnH2n+1 derived from an alkane by removal of a hydrogen atom from any carbon atom."	
<http://purl.obolibrary.org/obo/FBcv_0005062>	"An enzyme that mediates a recombination exchange reaction between two DNA templates, each containing a specific recognition site. The recognition site for a particular site-specific recombinase is defined by the enzyme itself. The recognition site contains perfect inverted repeats flanking an asymmetric spacer. Under normal conditions, the two recognition sites are identical and are reformed during the recombination event, and thus the reaction is bidirectional: recombination can occur in both 'forward' and 'reverse' directions. However, recognition sites can be mutated to drive the directionality of the reaction: different classes of site may be combined so that recombination can occur in one direction, but produces reformed sites that are no longer compatible. In addition, mutually exclusive sites have been engineered for some recombinases. Recombinases can be used to generate many different types of genetic modification, with the outcome being influenced by the relative orientation (direct or inverted), relative location and composition of the two recognition sites. The types of possible modification include deletion of DNA, generation of chromosomal rearrangements, integration of DNA into the genome, and replacement of genetic material with that from a donor plasmid using recombination-mediated cassette exchange (RMCE)."	
<http://purl.obolibrary.org/obo/FBcv_0000217>	"A written or recorded communication directed at members of the news media for the purpose of announcing something ostensibly newsworthy."	
<http://purl.obolibrary.org/obo/CHEBI_23824>	"A compound that contains two hydroxy groups, generally assumed to be, but not necessarily, alcoholic. Aliphatic diols are also called glycols."	"Wikipedia:Diol"
<http://purl.obolibrary.org/obo/FBcv_0000693>	"Allele shown by molecular evidence to make either a functionally wild-type gene product at increased levels or a gene product with the same function as wild-type but with increased activity."	
<http://purl.obolibrary.org/obo/FBcv_0000362>	"Phenotype that is an increase in the number of cells in a whole animal or in some specific organ, tissue or clone of cells compared to wild-type."	
<http://purl.obolibrary.org/obo/CHEBI_33253>	"Heavy nuclear particle: proton or neutron."	
<http://purl.obolibrary.org/obo/FBcv_0007501>	"Phenotype that is any abnormality in short-term memory (GO:0007614). 'short-term memory' is defined as: 'The memory process that deals with the storage, retrieval and modification of information received a short time (up to about 30 minutes) ago. This type of memory is typically dependent on direct, transient effects of second messenger activation.'"	
<http://purl.obolibrary.org/obo/FBcv_0000516>	"Mutation induced by exposure to neutron radiation."	
<http://purl.obolibrary.org/obo/FBcv_0007057>	"Sequence encoding a site-specific DNA-binding domain fused to a heterodimerization domain, where the process of heterodimerization mediated by this domain can be regulated by irradiation with a pulse of light. A functional transcription driver can be reconstituted in vivo if this split system component is brought together with a split system component that encodes a transcription activation domain fused to the complementary heterodimerization domain and the appropriate light stimulus is applied."	
<http://purl.obolibrary.org/obo/FBcv_0003220>	"A method that uses an RNA-seq assay in which only one end of the library fragment is sequenced."	
<http://purl.obolibrary.org/obo/FBcv_0000618>		
<http://purl.obolibrary.org/obo/FBcv_0000380>	"Genotype g1 is a non-enhancer of variegation of the phenotype due to genotype g2 if, and only if, g2 has a variegated phenotype and the degree of variegation caused by g1g2 is not greater than that caused by g2 alone."	
<http://purl.obolibrary.org/obo/FBcv_0000041>	"A spatial quality inhering in a bearer by virtue of the bearer's being located toward the back or upper surface of an organism relative to another entity."	"PATO:0001233"
<http://purl.obolibrary.org/obo/CHEBI_60242>	"An atom or small molecule with a positive charge that does not contain carbon in covalent linkage, with a valency of one."	
<http://purl.obolibrary.org/obo/FBcv_0005042>	"Sequence that forms part of the gene product encoded by a transgenic locus or modified endogenous locus and which results in the tagged gene product being targeted for degradation."	
<http://purl.obolibrary.org/obo/CHEBI_37022>		
<http://purl.obolibrary.org/obo/FBcv_0000509>	"Mutation induced by exposure to 226Ra alpha rays."	
<http://purl.obolibrary.org/obo/FBcv_0000775>	"An allele shown by molecular evidence to produce a gene product with a novel function or expression pattern (compared to wild-type) at some temperatures but not others."	
<http://purl.obolibrary.org/obo/FBcv_0000744>	"An allele shown by molecular evidence to completely lack function at some temperatures (restrictive temperatures) but not at others (permissive temperatures)."	
<http://purl.obolibrary.org/obo/CHEBI_19508>		
<http://purl.obolibrary.org/obo/FBcv_0005014>	"Protein having well characterized fluorescence excitation and emission spectra, with an emission peak equal or greater than 670nm."	
<http://purl.obolibrary.org/obo/FBcv_0003205>	"Random oligomers that have been used to prime first strand cDNA synthesis by reverse transcriptase at random positions along transcripts."	
<http://purl.obolibrary.org/obo/FBcv_0000747>	"An allele that at low temperatures but not high temperatures, either makes no functional gene product, makes reduced levels of a normally functioning gene product or makes a gene product with reduced activity compared to wild-type."	
<http://purl.obolibrary.org/obo/CHEBI_60809>	"Any pharmacological or immunological agent that modifies the effect of other agents such as drugs or vaccines while having few if any direct effects when given by itself."	
<http://purl.obolibrary.org/obo/CHEBI_25392>	"Any hydroxynaphthalene derivative that has a single hydroxy substituent."	
<http://purl.obolibrary.org/obo/FBcv_0000617>		
<http://purl.obolibrary.org/obo/FBcv_0003107>	"A result that represents the mapping of coordinates between two different genome assemblies for a given species."	
<http://purl.obolibrary.org/obo/FBcv_0010024>		
<http://purl.obolibrary.org/obo/FBcv_0007048>	"Present in the correct location but in smaller numbers than in wild-type."	
<http://purl.obolibrary.org/obo/FBcv_0000414>	"Phenotype that is any abnormality in locomotory behavior (GO:0007626). 'locomotory behavior' is defined as: 'The specific movement from place to place of an organism in response to external or internal stimuli. Locomotion of a whole organism in a manner dependent upon some combination of that organism's internal state and external conditions.'"	
<http://purl.obolibrary.org/obo/CHEBI_47868>	"A chemical compound that can be excited by light of a specific wavelength and subsequently transfer energy to a chosen reactant. This is commonly molecular oxygen within a cancer tissue, which is converted to (highly rective) singlet state oxygen. This rapidly reacts with any nearby biomolecules, ultimately killing the cancer cells."	
<http://purl.obolibrary.org/obo/FBcv_0000458>	"Mutation induced by an in vitro construct that uses site directed mutagenesis to target a particular region of the gene."	
<http://purl.obolibrary.org/obo/CHEBI_65255>	"Substances which are added to food in order to prevent decomposition caused by  microbial growth or by undesirable chemical changes."	
<http://purl.obolibrary.org/obo/FBcv_0000042>		
<http://purl.obolibrary.org/obo/FBcv_0000175>		
<http://purl.obolibrary.org/obo/FBcv_0000401>	"Phenotype that is any abnormality in circadian mating behavior (GO:0035648). 'circadian mating behavior' is defined as: 'The fluctuation in mating behavior that occurs over an approximately 24 hour cycle.'"	
<http://purl.obolibrary.org/obo/FBcv_0000547>	"A haloalkane that is bromoethane substituted by chlorine at position 2 (from CHEBI)."	
<http://purl.obolibrary.org/obo/CHEBI_35444>	"A substance used in the treatment or control of nematode infestations."	
<http://purl.obolibrary.org/obo/CHEBI_64641>	"An inorganic cation with a valency of two."	
<http://purl.obolibrary.org/obo/FBcv_0003167>	"A sample that has been exposed to one or more forms of chemical agent."	
<http://purl.obolibrary.org/obo/CHEBI_29922>		"PDBeChem:SFO"
<http://purl.obolibrary.org/obo/CHEBI_26548>		
<http://purl.obolibrary.org/obo/FBcv_0005037>	"Sequence that forms part of the gene product encoded by a transgenic locus or modified endogenous locus and which is used to regulate the activity of the tagged gene product."	
<http://purl.obolibrary.org/obo/FBcv_0000594>	"No definition for CHEBI:25813."	
<http://purl.obolibrary.org/obo/FBcv_0000336>	"A clone of somatic cells that share a genotype that is different from the genotype of the animal in which it resides and from which it is derived."	
<http://purl.obolibrary.org/obo/FBcv_0000769>	"An allele that, at some temperatures but not others, makes a gene product with a novel function or expression pattern compared to wild-type."	
<http://purl.obolibrary.org/obo/FBcv_0000048>	"A spatial quality inhering in a bearer by virtue of the bearer's being extended on all sides of another entity simultaneously."	"PATO:0001772"
<http://purl.obolibrary.org/obo/CHEBI_76725>	"An enzyme inhibitor which interferes with the action of an oxidoreductase (EC 1.*.*.*)."	"Wikipedia:Oxidoreductase"
<http://purl.obolibrary.org/obo/FBcv_0007068>	"Sequence that forms all or part of the gene product encoded by a transgenic locus or modified endogenous locus and which can be used to target a gene product for degradation in a defined manner."	
<http://purl.obolibrary.org/obo/CHEBI_22495>		
<http://purl.obolibrary.org/obo/FBcv_0000174>		
<http://purl.obolibrary.org/obo/FBcv_0007520>	"Phenotype that is a decrease in the efficacy of short-term memory (GO:0007614) relative to controls. 'short-term memory' is defined as: 'The memory process that deals with the storage, retrieval and modification of information received a short time (up to about 30 minutes) ago. This type of memory is typically dependent on direct, transient effects of second messenger activation.'"	
<http://purl.obolibrary.org/obo/FBcv_0003017>	"Genes whose products act in a specified signal transduction or metabolic pathway."	
<http://purl.obolibrary.org/obo/CHEBI_58958>	"An organic anion of general formula RS(=O)2O(-) where R is an organyl group."	
<http://purl.obolibrary.org/obo/FBcv_0000620>	"Qualifier that describes the relation between two phenotypes that are due to genotypes g1 and g2."	
<http://purl.obolibrary.org/obo/FBcv_0006004>	"Phenotype that is any abnormality in oviposition (GO:0018991) despite production of eggs. 'oviposition' is defined as: 'A reproductive behavior that results in the deposition of eggs (either fertilized or not) upon a surface or into a medium such as water.'."	
<http://purl.obolibrary.org/obo/FBcv_0003003>	"Contrary to expectation, does not make a condition worse."	
<http://purl.obolibrary.org/obo/CHEBI_77402>	"An EC 1.8.1.* (oxidoreductase acting on sulfur group of donors, NAD+ or NADP+ as acceptor) inhibitor that interferes with the action of trypanothione-disulfide reductase (EC 1.8.1.12)."	"Wikipedia:Trypanothione-disulfide_reductase"
<http://purl.obolibrary.org/obo/FBcv_0000139>	"90-100% of egg length from the posterior tip (0%) of the egg or pre-gastrula embryo."	
<http://purl.obolibrary.org/obo/FBcv_0000396>	"Phenotype that is any abnormality in eclosion rhythm (GO:0008062). 'eclosion rhythm' is defined as: 'The timing of the emergence of the adult fly from its pupal case, which usually occurs at dawn.'"	
<http://purl.obolibrary.org/obo/FBcv_0003060>	"An assay that maps the genome-wide position, orientation and amount of transcriptionally engaged RNA polymerase by global run-on sequencing."	
<http://purl.obolibrary.org/obo/CHEBI_61120>	"Any compound that has a nucleobase as a part."	
<http://purl.obolibrary.org/obo/FBcv_0000619>		
<http://purl.obolibrary.org/obo/FBcv_0000148>	"Expression in odd, but not even numbered segments of the blastoderm."	
<http://purl.obolibrary.org/obo/FBcv_0002005>	"A phenotype of a population that is the death of all animals in that population during the P-stage."	
<http://purl.obolibrary.org/obo/FBcv_0007016>	"Sequence that forms all or part of the gene product encoded by a transgenic locus or modified endogenous locus and that confers a specific property used to ablate a specific cell or anatomical structure, where this property can be regulated by irradiation with a pulse of light."	
<http://purl.obolibrary.org/obo/FBcv_0001003>	"An allele that completely lacks function (i.e. whose gene productive is completely inactive) at low temperatures, but that retains at least some function at higher temperatures."	
<http://purl.obolibrary.org/obo/FBcv_0000411>	"Phenotype that is any abnormality in visual behavior (GO:0007632). 'visual behavior' is defined as: 'The behavior of an organism in response to a visual stimulus.'"	
<http://purl.obolibrary.org/obo/FBcv_0000104>	"20-80% of egg length from the posterior tip (0%) of the egg or pre-gastrula embryo."	
<http://purl.obolibrary.org/obo/CHEBI_25699>		
<http://purl.obolibrary.org/obo/CHEBI_22494>		
<http://purl.obolibrary.org/obo/FBcv_0000091>	"10-50% of egg length from the posterior tip (0%) of the egg or pre-gastrula embryo."	
<http://purl.obolibrary.org/obo/FBcv_0000044>		
<http://purl.obolibrary.org/obo/FBcv_0000202>	"A record of a protein sequence in some standard format, such as UniProtKB."	
<http://purl.obolibrary.org/obo/FBcv_0000623>	"Genotype g1 is enhancer of genotype g2 if (and only if) the phenotype due to the genotype g1g2 is more severe than the sum of phenotypes due to g1 and g2, where all comparisons are under identical environmental conditions."	
<http://purl.obolibrary.org/obo/CHEBI_25348>		
<http://purl.obolibrary.org/obo/FBcv_0003121>	"A descriptor that describes some aspect of a dataset."	
<http://purl.obolibrary.org/obo/FBcv_0003119>	"A collection of transposable element insertions available as fly stocks."	
<http://purl.obolibrary.org/obo/CHEBI_33459>		
<http://purl.obolibrary.org/obo/FBcv_0000434>	"Phenotype that is any abnormality in the electrophysiological properties of some class of neurons, muscles or other anatomical structure of the nervous system. Examples of these phenotypes at the neuron class level include defects in spontaneous or evoked excitatory junction potential. Examples at a more gross anatomical level include abnormal retinal electrophysiology (e.g.- measured by an electroretinogram)."	
<http://purl.obolibrary.org/obo/FBcv_0000209>	"A work consisting of an announcement or statement of recent or current events of new data and matters of interest in the field of medicine or science, published in a scientific journal."	"MeSH:D016433"
<http://purl.obolibrary.org/obo/FBcv_0000358>	"Phenotype that is a decrease in body size compared to identically raised wild-type controls."	
<http://purl.obolibrary.org/obo/FBcv_0000356>	"A phenotype that is any abnormality in body color compared to wild-type."	
<http://purl.obolibrary.org/obo/FBcv_0000498>	"Mutation caused by hybrid dysgenesis that results from the mobilization of the hobo element."	
<http://purl.obolibrary.org/obo/CHEBI_48706>	"Substance that attaches to and blocks cell receptors that normally bind naturally occurring substances."	
<http://purl.obolibrary.org/obo/FBcv_0000177>		
<http://purl.obolibrary.org/obo/FBcv_0000589>	"No definition for CHEBI:21184."	
<http://purl.obolibrary.org/obo/FBcv_0003088>	"A result that provides the expression values for all (or some subset) of genes in a given biological sample."	
<http://purl.obolibrary.org/obo/FBcv_0000043>		
<http://purl.obolibrary.org/obo/FBcv_0000176>		
<http://purl.obolibrary.org/obo/FBcv_0002026>	"A phenotype of a population that is the death of all animals in that population at some stage or stages before the end of the prepupal stage."	
<http://purl.obolibrary.org/obo/CHEBI_30879>	"A compound in which a hydroxy group, -OH, is attached to a saturated carbon atom."	"KEGG:C00069"
<http://purl.obolibrary.org/obo/FBcv_0000153>	"A phenotypic effect which is expressed in and limited to cells of the mutant genetic constitution under investigation is said to be cell autonomous."	
<http://purl.obolibrary.org/obo/CHEBI_29067>	"The conjugate base formed when the carboxy group of a carboxylic acid is deprotonated."	
<http://purl.obolibrary.org/obo/FBcv_0000152>	"A stock with one or more chromosomes (balancers) that are used primarily for their ability to preserve a stock genotype without selection."	
<http://purl.obolibrary.org/obo/CHEBI_33694>	"A macromolecule formed by a living organism."	
<http://purl.obolibrary.org/obo/FBcv_0000492>	"Mutation caused by PM hybrid dysgenesis that is induced by the higher frequency of recombination in certain male chromosomes."	
<http://purl.obolibrary.org/obo/CHEBI_51052>	"A thioxanthen-9-one compound having a methyl substituent at the 1-position and a 2-[(diethylamino)ethyl]amino substituent at the 4-position. Formerly used for the treatment of schistosomiasis. It is a prodrug, being metabolised to hycanthone."	"KEGG:C11715 HMDB:HMDB0015607 Wikipedia:Lucanthone DrugBank:DB04967"
<http://purl.obolibrary.org/obo/CHEBI_33240>	"An assembly consisting of a central atom (usually metallic) to which is attached a surrounding array of other groups of atoms (ligands)."	
<http://purl.obolibrary.org/obo/CHEBI_23359>	"An  alkaloid that is a carbotricyclic compound comprising 5,6,7,9-tetrahydrobenzo[a]heptalene having four methoxy substituents at the 1-, 2-, 3- and 10-positions as well as an oxo group at the 9-position and an acetamido group at the 7-position. It has been isolated from the plants belonging to genus Colchicum."	"LINCS:LSM-6449 HMDB:HMDB0015466 DrugBank:DB01394"
<http://purl.obolibrary.org/obo/CHEBI_76731>	"An oxidoreductase inhibitor which interferes with the action of an oxidoreductase acting on the CH-NH group of donors (EC 1.5.*.*)."	
<http://purl.obolibrary.org/obo/FBcv_0005023>	"A peptide sequence that forms part of the protein product encoded by a transgenic locus or modified endogenous locus and which is used to target the tagged protein either to a specific subcellular location within the cell or for secretion to the extracellular space."	"SO:0001527"
<http://purl.obolibrary.org/obo/FBcv_0003043>	"A project type that is not described by other more specific terms."	
<http://purl.obolibrary.org/obo/FBcv_0007028>	"Catalytically inactive fragment of a recombinase. A functional recombinase can be reconstituted when complementary split recombinase fragments are brought together in vivo, for example by fusing the fragments to peptides that physically interact."	
