?cls	?def	?xrefs
<http://purl.obolibrary.org/obo/FBcv_0003066>	"An assay in which a factor is immunoprecipitated and the associated RNA sequences are characterized by high-throughput sequencing."	
<http://purl.obolibrary.org/obo/FBcv_0000111>	"30-70% of egg length from the posterior tip (0%) of the egg or pre-gastrula embryo."	
<http://purl.obolibrary.org/obo/FBcv_0007010>	"Sequence that forms all or part of the gene product encoded by a transgenic locus or modified endogenous locus and that confers a specific property that can be used to stimulate the activity of a neuron, where this property can be regulated by temperature."	
<http://purl.obolibrary.org/obo/FBcv_0000183>		
<http://purl.obolibrary.org/obo/CHEBI_22315>	"Any of the naturally occurring, basic nitrogen compounds (mostly heterocyclic) occurring mostly in the plant kingdom, but also found in bacteria, fungi, and animals. By extension, certain neutral compounds biogenetically related to basic alkaloids are also classed as alkaloids. Amino acids, peptides, proteins, nucleotides, nucleic acids, amino sugars and antibiotics are not normally regarded as alkaloids. Compounds in which the nitrogen is  exocyclic (dopamine, mescaline, serotonin, etc.) are usually classed as amines rather than alkaloids."	"Wikipedia:Alkaloid"
<http://purl.obolibrary.org/obo/FBcv_0005013>	"Protein having well characterized fluorescence excitation and emission spectra, with an emission peak within the wavelength range of 625-659nm."	
<http://purl.obolibrary.org/obo/CHEBI_27207>	"A univalent carboacyl group is a group formed by loss of OH from the carboxy group of a carboxylic acid."	
<http://purl.obolibrary.org/obo/FBcv_0003232>	"Mapping of short (200-500 bp) sequence-tagged sites (STS) landmarks to develop a physical map of a genome."	
<http://purl.obolibrary.org/obo/FBcv_0000754>	"An allele inferred from genetic evidence to have normal activity at some temperatures (permissive temperatures) but at other temperatures to make a gene product with normal function but in a lesser amount or with lowered activity (non-permissive temperatures). The genetic evidence must consist of an observation extra copies in the genome decrease the expressivity and/or penetrance of the phenotype at non-permissive temperatures. Most commonly this evidence takes the form of experiments showing that the homozygote (2 copies) has a weaker phenotype at non-permissive temperatures than the allele in trans to a deletion of the gene (1 copy))."	
<http://purl.obolibrary.org/obo/FBcv_0010015>		
<http://purl.obolibrary.org/obo/FBcv_0000214>	"A work that has not been formally published and that consists of observations or data submitted by a researcher or group of researchers directly to FlyBase."	
<http://purl.obolibrary.org/obo/CHEBI_50699>	"A compound in which monosaccharide units are joined by glycosidic linkages. The term is commonly used to refer to a defined structure as opposed to a polymer of unspecified length or a homologous mixture. When the linkages are of other types the compounds are regarded as oligosaccharide analogues."	"KEGG:C00930"
<http://purl.obolibrary.org/obo/FBcv_0000300>	"A phenotypic attribute is described as codominant when it is manifest in individuals carrying the allele that causes that phenotype, irrespective of the homologous allele."	
<http://purl.obolibrary.org/obo/FBcv_0000275>	"Publication in the Slovak language."	
<http://purl.obolibrary.org/obo/FBcv_0000457>	"Sequence change introduced by using an in vitro construct that contains a in-frame fusion of the open reading frames from two or more genes. In FlyBase, the resulting genes may be classified as fusion genes or tagged genes."	
<http://purl.obolibrary.org/obo/FBcv_0003027>	"A collection of material reagents."	
<http://purl.obolibrary.org/obo/FBcv_0009053>	"Non-functional fragment of an RNA-guided nuclease that can be used to reconstitute a functional RNA-guided nuclease when brought together in vivo with a complementary split RNA-guided nuclease fragment, where the process that brings the complementary fragments together can be regulated by binding to a small molecule, such as an ion or ligand."	
<http://purl.obolibrary.org/obo/FBcv_0000349>	"A phenotype that is survival to mature adulthood, where mature is defined as after adult stage A3 (FBdv:00006012)."	
<http://purl.obolibrary.org/obo/FBcv_0000182>		
<http://purl.obolibrary.org/obo/FBcv_0000070>	"Restricted to ventral region of some specified type."	
<http://purl.obolibrary.org/obo/CHEBI_35352>	"Any heteroorganic entity containing at least one carbon-nitrogen bond."	
<http://purl.obolibrary.org/obo/FBcv_0009020>	"Nuclei of a single cell type have been isolated with the TAPIN (Tandem Affinity Purification of Intact Nuclei) strategy (Davis et al., 2020)."	
<http://purl.obolibrary.org/obo/FBcv_0000150>	"Restricted to a segmentally repeated pattern with some specified type."	
<http://purl.obolibrary.org/obo/CHEBI_38034>		
<http://purl.obolibrary.org/obo/CHEBI_33666>		
<http://purl.obolibrary.org/obo/CHEBI_33576>	"Any carboxylic acid having a sulfur substituent."	
<http://purl.obolibrary.org/obo/FBcv_0003019>	"Mutation caused by the transposable activity caused by the I-element, a non-LTR retrotransposon. The I-element is 5371 base pairs long. Mobilization is induced by the activity of the I-element transposase."	
<http://purl.obolibrary.org/obo/CHEBI_33856>	"An amino acid whose structure includes an aromatic ring."	"KEGG:C01021 Wikipedia:Aromatic_amino_acid"
<http://purl.obolibrary.org/obo/FBcv_0010014>		
<http://purl.obolibrary.org/obo/FBcv_0005057>	"Sequence that forms part of the protein product encoded by a transgenic locus or modified endogenous locus and which allows the tagged protein product to be cleaved (broken into smaller molecules by the rupture of a covalent bond) by a specific process. Examples of protein cleavage tags include sequences recognized and cleaved by proteases such as the human rhinovirus (HRV) 3C protease (often produced with the tradename PreScission Protease) and the tobacco etch virus (TEV) protease. Protein product cleavage can be used for a number of different purposes, including release of a protein after purification, or removal of a detection tag to assess that the tag does not interfere with protein function."	
<http://purl.obolibrary.org/obo/FBcv_0000076>	"0-10% of egg length from the posterior tip of the egg or pre-gastrula embryo."	
<http://purl.obolibrary.org/obo/FBcv_0000410>	"Phenotype that is any abnormality in response to heat (GO:0009408). 'response to heat' is defined as: 'Any process that results in a change in state or activity of a cell or an organism (in terms of movement, secretion, enzyme production, gene expression, etc.) as a result of a heat stimulus, a temperature stimulus above the optimal temperature for that organism.'"	
<http://purl.obolibrary.org/obo/FBcv_0000534>	"An ethyl sulfide that is diethyl sulfide in which a hydrogen from each of the terminal methyl groups is replaced by a chlorine. It is a powerful vesicant regulated under the Chemical Weapons Convention (from CHEBI)."	
<http://purl.obolibrary.org/obo/CHEBI_38808>	"A membrane transport modulator that is able to regulate intracellular calcium levels."	
<http://purl.obolibrary.org/obo/CHEBI_26607>	"Any fatty acid containing no carbon to carbon multiple bonds. Known to produce adverse biological effects when ingested to excess."	
<http://purl.obolibrary.org/obo/FBcv_0007017>	"Sequence that forms all or part of the gene product encoded by a transgenic locus or modified endogenous locus and that confers a specific property used to ablate a specific cell or anatomical structure, where this property can be regulated by binding to a small molecule, such as an ion or ligand."	
<http://purl.obolibrary.org/obo/CHEBI_33662>	"A mancude monocyclic hydrocarbon without side chains of the general formula CnHn (n is an even number) or CnHn+1 (n is an odd number). In systematic nomenclature an annulene with seven or more carbon atoms may be named [n]annulene, where n is the number of carbon atoms."	
<http://purl.obolibrary.org/obo/FBcv_0000815>	"A monocarboxylic acid that is butanoic acid substituted at position 4 by a 4-[bis(2-chloroethyl)amino]phenyl group. A chemotherapy drug that can be used in combination with the antibody obinutuzumab for the treatment of chronic lymphocytic leukemia (from CHEBI)."	
<http://purl.obolibrary.org/obo/FBcv_0000185>		
<http://purl.obolibrary.org/obo/CHEBI_18367>	"A phosphate ion that is the conjugate base of hydrogenphosphate."	"Wikipedia:Phosphate PDBeChem:PO4 KEGG:C00009"
<http://purl.obolibrary.org/obo/CHEBI_48356>	"A polar solvent that is capable of acting as a hydron (proton) donor."	
<http://purl.obolibrary.org/obo/CHEBI_33598>	"A homocyclic compound in which all of the ring members are carbon atoms."	
<http://purl.obolibrary.org/obo/FBcv_0000792>	"A phenotype in which the aging process is accelerated compared to wild-type."	
<http://purl.obolibrary.org/obo/CHEBI_38166>		
<http://purl.obolibrary.org/obo/FBcv_0003020>	"Mutation caused by the transposable activity caused by the Stalker element, a LTR retrotransposon. Mobilization is induced by the activity of the stalker element transposase."	
<http://purl.obolibrary.org/obo/FBcv_0007534>	"Phenotype that is an increase in any kind of rate (e.g. speed, frequency) of grooming behavior (GO:0007625). 'grooming behavior' is defined as: 'The specific behavior of an organism relating to grooming, cleaning and brushing to remove dirt and parasites.'."	
<http://purl.obolibrary.org/obo/CHEBI_50266>	"A compound that, on administration, must undergo chemical conversion by metabolic processes before becoming the pharmacologically active drug for which it is a prodrug."	"Wikipedia:Prodrug"
<http://purl.obolibrary.org/obo/FBcv_0005077>	"An enzyme that catalyzes hydrolysis of DNA in a site-specific manner. When used in vivo, the DNA cutting stimulates cellular repair mechanisms, which can be exploited to produce genome modifications. For example, repair by homologous recombination in the presence of an exogenous template can be used to introduce targeted changes into the genome."	
<http://purl.obolibrary.org/obo/CHEBI_33304>	"Any p-block molecular entity containing a chalcogen."	
<http://purl.obolibrary.org/obo/FBcv_0010013>		
<http://purl.obolibrary.org/obo/FBcv_0003211>	"A method that uses high-throughput sequencing for this assay."	
<http://purl.obolibrary.org/obo/FBcv_0000342>	"Qualifier that describes a phenotype that has poor penetrance or expressivity."	
<http://purl.obolibrary.org/obo/FBcv_0000700>	"Embryonic/larval segmentation phenotype that is the complete or partial loss of even segments."	
<http://purl.obolibrary.org/obo/FBcv_0003009>	"Sequence change caused by the cleavage of specific DNA sequences by transcription activator-like effector nucleases (TALENs). TALEN proteins comprise a DNA binding domain fused to the catalytic domain of the FokI endonuclease. The DNA binding domain contains a repetitive region within the middle of the protein, consisting of tandem repeats of 34 amino acid segments, with each of these segments recognizing a single base pair. The specificity of the binding is determined by two hypervariable amino acids in positions 12 and 13 (repeat-variable diresidues). Cleavage requires dimerization of FokI. The endonuclease is directed to a target region by a pair of TALENs which bind to adjacent sequences separated by a spacer region, allowing dimerization and promoting cleavage."	
<http://purl.obolibrary.org/obo/FBcv_0000583>	"No definition for CHEBI:28954."	
<http://purl.obolibrary.org/obo/FBcv_0000184>		
<http://purl.obolibrary.org/obo/CHEBI_62031>	"Zwitterionic form of a polar amino acid having an anionic carboxy group and a protonated amino group."	
<http://purl.obolibrary.org/obo/FBcv_0000000>	"FlyBase miscellaneous controlled vocabulary term."	
<http://purl.obolibrary.org/obo/FBcv_0000345>	"Qualifier that describes an electrophoretic migration of a gene product that is intermediate in speed compared to the wild-type."	"PATO:0000303"
<http://purl.obolibrary.org/obo/FBcv_0000521>	"Mutation induced by exposure to radio waves."	
<http://purl.obolibrary.org/obo/FBcv_0007009>	"Sequence that forms all or part of the gene product encoded by a transgenic locus or modified endogenous locus and that confers a specific property that can be used to stimulate the activity of a neuron, where this property can be regulated in response to a particular stimulus."	
<http://purl.obolibrary.org/obo/FBcv_0000188>	"Qualifier that describes the type of publication."	
<http://purl.obolibrary.org/obo/FBcv_0000595>	"No definition for CHEBI:25814."	
<http://purl.obolibrary.org/obo/CHEBI_48873>	"Any drug that binds to but does not activate cholinergic receptors, thereby blocking the actions of acetylcholine or cholinergic agonists."	
<http://purl.obolibrary.org/obo/FBcv_0002022>	"A phenotype of a population that is the death of a significant proportion of animals in that population during the second instar larval stage."	
<http://purl.obolibrary.org/obo/FBcv_0000039>	"A spatial quality inhering in a bearer by virtue of the bearer's being located toward the front of an organism relative to another entity."	"PATO:0001632"
<http://purl.obolibrary.org/obo/CHEBI_33402>		
<http://purl.obolibrary.org/obo/CHEBI_37808>	"A straight chain alkane composed of 4 carbon atoms."	"PDBeChem:NBU Wikipedia:Butane"
<http://purl.obolibrary.org/obo/CHEBI_71232>	"An antagonist at any adenosine receptor."	"Wikipedia:Adenosine_receptor"
<http://purl.obolibrary.org/obo/CHEBI_38975>	"Any alkylbenzene that is benzene substituted with one or more methyl groups."	
<http://purl.obolibrary.org/obo/CHEBI_35568>	"Any molecular entity that consists of a ring having (formally) the maximum number of noncumulative double bonds."	
<http://purl.obolibrary.org/obo/FBcv_0000502>	"Mutation induced by the transposable activity caused by piggyBac, a DNA transposable element. The piggyBac is 2.5 kilobases in length with 13 base pairs inverted terminal repeats. It specifically targets TTAA dinucleotides and generates a flanking duplication of these 4 base pairs upon insertion. Mobilization is induced by the activity of the piggyBac transposase."	
<http://purl.obolibrary.org/obo/CHEBI_13941>		
<http://purl.obolibrary.org/obo/CHEBI_33317>		
<http://purl.obolibrary.org/obo/FBcv_0003056>	"A genome binding assay of some protein as characterized by creating a fusion to DNA adenine methyltransferase and analysis of methylated DNA sequences by high-throughput sequencing."	
<http://purl.obolibrary.org/obo/FBcv_0000629>		
<http://purl.obolibrary.org/obo/FBcv_0010012>		
<http://purl.obolibrary.org/obo/CHEBI_50903>	"A role played by a chemical compound which is known to  induce a process of carcinogenesis  by corrupting  normal cellular pathways, leading to the acquistion of tumoral capabilities."	
<http://purl.obolibrary.org/obo/FBcv_0000377>	"A phenotype that is the ability of females to produce fertilized eggs as a result of mating."	
<http://purl.obolibrary.org/obo/FBcv_0000280>	"Publication in the Ukrainian language."	
<http://purl.obolibrary.org/obo/FBcv_0003186>	"The biosample that is depleted of specific biomolecule types before further processing."	
<http://purl.obolibrary.org/obo/CHEBI_17891>	"A molecular entity that can transfer (\"donate\") an electron, a pair of electrons, an atom or a group to another molecular entity."	"KEGG:C01351"
<http://purl.obolibrary.org/obo/FBcv_0003142>	"A biosample that is derived from multiple species."	
<http://purl.obolibrary.org/obo/FBcv_0000334>	"Expressed in females."	
<http://purl.obolibrary.org/obo/FBcv_0000734>	"Embryonic/larval segmentation phenotype that is the complete or partial loss of terminal regions of the embryo/larva: the acron, telson and immediately adjacent segments."	
<http://purl.obolibrary.org/obo/CHEBI_35942>	"A substance used for its pharmacological action on any aspect of neurotransmitter systems. Neurotransmitter agents include agonists, antagonists, degradation inhibitors, uptake inhibitors, depleters, precursors, and modulators of receptor function."	
<http://purl.obolibrary.org/obo/FBcv_0000187>		
<http://purl.obolibrary.org/obo/CHEBI_50909>	"A role played by a chemical compound exihibiting itself through the ability to induce damage to the kidney in animals."	
<http://purl.obolibrary.org/obo/CHEBI_33663>		
<http://purl.obolibrary.org/obo/CHEBI_17578>	"The simplest member of the class toluenes consisting of a benzene core which bears a single methyl substituent."	"DrugBank:DB01900 KEGG:C01455 Wikipedia:Toluene PDBeChem:MBN"
<http://purl.obolibrary.org/obo/CHEBI_58095>	"An amino acid zwitterion arising from transfer of a proton from the carboxy to the amino group of L-phenylalanine; major species at pH 7.3."	"MetaCyc:PHE"
<http://purl.obolibrary.org/obo/CHEBI_84735>	"Any eukaryotic metabolite produced during a metabolic reaction in algae including unicellular organisms like chlorella and diatoms to multicellular organisms like giant kelps and brown algae."	
<http://purl.obolibrary.org/obo/CHEBI_25224>	"A 1,1-diunsubstituted alkanesulfonate that is the conjugate base of methanesulfonic acid."	"MetaCyc:CPD-3746"
<http://purl.obolibrary.org/obo/CHEBI_19032>	"A haloalkane that is bromoethane substituted by chlorine at position 2."	
<http://purl.obolibrary.org/obo/FBcv_0000166>	"Qualifier that describes an observed expression pattern."	
<http://purl.obolibrary.org/obo/FBcv_0000787>	"A publication issued on a regular, ongoing basis containing separate research articles and other writings such as reviews, comments and conference reports."	"MeSH:D020492"
<http://purl.obolibrary.org/obo/CHEBI_48024>	"Any hydroxyflavanone with a hydroxy substituent at position 3' of the phenyl ring."	"MetaCyc:3-Hydroxy-Flavanones"
<http://purl.obolibrary.org/obo/CHEBI_16716>	"A six-carbon aromatic annulene in which each carbon atom donates one of its two 2p electrons into a delocalised pi system. A toxic, flammable liquid byproduct of coal distillation, it is used as an industrial solvent. Benzene is a carcinogen that also damages bone marrow and the central nervous system."	"HMDB:HMDB0001505 KEGG:C01407 PDBeChem:BNZ Wikipedia:Benzene"
<http://purl.obolibrary.org/obo/FBcv_0000766>	"An allele that has been shown by molecular evidence to make a gene product that is antagonistic to the function of the wild-type gene product at some temperatures but not others."	
<http://purl.obolibrary.org/obo/FBcv_0003195>	"Material that has been selected using Cap Analysis Gene Expression, in which the 7-methylguanosine cap at 5' transcript ends is biotinylated and affinity purified."	
<http://purl.obolibrary.org/obo/FBcv_0005060>	"Specific DNA sequence that is used as the effector in a binary expression system. This system requires a transactivator ('driver') that binds to a specific DNA sequence ('regulatory region' or 'effector'). A driver encoded by one transgenic locus or modified endogenous locus is used to drive expression of a downstream 'responder' or 'reporter' encoded by another transgenic locus or modified endogenous locus, by fusing the regulatory region sequence to which the driver binds upstream of the responder sequence. The temporal and spatial expression pattern of the responder thus depends on the regulatory elements used to drive expression of the driver. In addition, a specific repressor protein may be available which prevents the transactivator from driving expression, allowing further refinement of the expression pattern of the responder."	
<http://purl.obolibrary.org/obo/CHEBI_23414>	"A metal sulfate compound having copper(2+) as the metal ion."	"Wikipedia:Copper(II)_sulfate KEGG:C18713 PPDB:178"
<http://purl.obolibrary.org/obo/FBcv_0000108>	"30-40% of egg length from the posterior tip (0%) of the egg or pre-gastrula embryo."	
<http://purl.obolibrary.org/obo/FBcv_0010019>		
<http://purl.obolibrary.org/obo/FBcv_0000186>		
<http://purl.obolibrary.org/obo/CHEBI_35504>	"An addition compound contains two or more simpler compounds that can be packed in a definite ratio into a crystal. The term covers donor-acceptor complexes (adducts) and a variety of lattice compounds."	
<http://purl.obolibrary.org/obo/CHEBI_52768>	"A thioxanthen-9-one compound having a hydroxymethyl substituent at the 1-position and a 2-[(diethylamino)ethyl]amino substituent at the 4-position. It was formerly used (particularly as the monomethanesulfonic acid salt) as a schistosomicide for individual or mass treatement of infection with Schistosoma haematobium and S. mansoni, but due to its toxicity and concern about possible carcinogenicity, it has been replaced by other drugs such as praziquantel."	"Patent:US3294803 LINCS:LSM-5614 Wikipedia:Hycanthone KEGG:D00541 Patent:NL6410359 Patent:US3312598"
<http://purl.obolibrary.org/obo/FBcv_0003001>	"Makes a condition better."	
<http://purl.obolibrary.org/obo/CHEBI_35481>	"A drug that has principally analgesic, antipyretic and anti-inflammatory actions. Non-narcotic analgesics do not bind to opioid receptors."	
<http://purl.obolibrary.org/obo/FBcv_0000316>	"Phenotype that is the partial or full transformation of one or more segments (FBbt:00000003) or segmental appendages from one identity to another. For example, in antennapedia an antenna is partially or fully transformed into a leg."	
<http://purl.obolibrary.org/obo/CHEBI_83813>	"Any of the 23 alpha-amino acids that are precursors to proteins, and are incorporated into proteins during translation. The group includes the 20 amino acids encoded by the nuclear genes of eukaryotes together with selenocysteine, pyrrolysine, and N-formylmethionine. Apart from glycine, which is non-chiral, all have L configuration."	"Wikipedia:Proteinogenic_amino_acid"
<http://purl.obolibrary.org/obo/CHEBI_17821>	"A pyrimidine nucleobase that is uracil in which the hydrogen at position 5 is replaced by a methyl group."	"Wikipedia:Thymine DrugBank:DB03462 PDBeChem:TDR KEGG:C00178 KNApSAcK:C00001511"
<http://purl.obolibrary.org/obo/CHEBI_36043>	"A drug used to treat or prevent microbial infections."	
<http://purl.obolibrary.org/obo/FBcv_0003025>	"Quantitative or qualitative assessment of biological source material to measure some attribute."	
<http://purl.obolibrary.org/obo/FBcv_0000378>	"A phenotype in which all offspring are sterile. Typically, this is due to maternal effect sterility resulting from defects in pole cell development."	
<http://purl.obolibrary.org/obo/FBcv_0010018>		
<http://purl.obolibrary.org/obo/FBcv_0000392>	"A phenotype consisting of an increase in any kind of rate (e.g. speed, frequency) of `multicellular organismal movement` (GO:0050879) compared to wild-type."	
<http://purl.obolibrary.org/obo/FBcv_0000801>		
<http://purl.obolibrary.org/obo/FBcv_0009025>	"A result that provides the expression values for all (or some subset of) genes in a given biological sample obtained using a specific transcriptional driver (or combination of drivers), when that driver is not associated to a clearly identified cell type."	
<http://purl.obolibrary.org/obo/FBcv_0000131>	"70% of egg length from the posterior tip of the egg or pre-gastrula embryo."	
<http://purl.obolibrary.org/obo/CHEBI_28954>		"KNApSAcK:C00001857 KEGG:C09438"
<http://purl.obolibrary.org/obo/FBcv_0007553>	"Phenotype that is a decrease in any kind of rate (e.g. speed, frequency) of flight behavior (GO:0007629). 'flight behavior' is defined as: 'The response to external or internal stimuli that results in the locomotory process of flight. Flight is the self-propelled movement of an organism through the air.'."	
<http://purl.obolibrary.org/obo/CHEBI_13643>	"A diol in which the two hydroxy groups are on different carbon atoms, usually but not necessarily adjacent."	
<http://purl.obolibrary.org/obo/FBcv_0000277>	"Publication in the Spanish language."	
<http://purl.obolibrary.org/obo/FBcv_0002025>	"A phenotype of a population that is the death of all animals in that population during the pharate adult stage."	
<http://purl.obolibrary.org/obo/CHEBI_16998>	"The D-enantiomer of phenylalanine."	"YMDB:YMDB00995 PDBeChem:DPN ECMDB:ECMDB20144 MetaCyc:CPD-216 DrugBank:DB02556 KEGG:C02265"
<http://purl.obolibrary.org/obo/CHEBI_38941>	"Drugs that used to treat infestations by flukes (trematodes) of the genus Schistosoma."	
<http://purl.obolibrary.org/obo/FBcv_0003005>	"Makes a condition worse."	
<http://purl.obolibrary.org/obo/FBcv_0000167>	"Weak expression."	
<http://purl.obolibrary.org/obo/FBcv_0003137>	"Characteristics pertaining to the growth conditions, treatments and tissue isolation methods used to generate and obtain a biosample."	
<http://purl.obolibrary.org/obo/CHEBI_38037>		
<http://purl.obolibrary.org/obo/FBcv_0000575>	"A trimethylxanthine in which the three methyl groups are located at positions 1, 3, and 7. A purine alkaloid that occurs naturally in tea and coffee (from CHEBI)."	
<http://purl.obolibrary.org/obo/CHEBI_60251>	"R = C or H. The iminium ion resulting from the protonation of one of the imine nitrogens of guanidine or its derivatives."	
<http://purl.obolibrary.org/obo/FBcv_0000145>	"Restricted to stripes in some specified type."	
<http://purl.obolibrary.org/obo/FBcv_0010017>		
<http://purl.obolibrary.org/obo/CHEBI_20552>	"A pyrimidine having keto groups at the 2- and 4-positions and a bromo group at the 5-position. Used mainly as an experimental mutagen."	
<http://purl.obolibrary.org/obo/CHEBI_27027>	"Any nutrient required in small quantities by organisms throughout their life in order to orchestrate a range of physiological functions."	"Wikipedia:Micronutrient"
<http://purl.obolibrary.org/obo/CHEBI_76967>	"Any human metabolite produced by metabolism of a xenobiotic compound in humans."	
<http://purl.obolibrary.org/obo/FBcv_0007506>	"Phenotype that is a decrease in body weight compared to identically raised wild-type controls."	
